run_id,student_id,grading_mode,rubric_version,model,temperature,timestamp,intro_grade,intro_feedback,intro_rubric_feedback,methods_grade,methods_feedback,methods_rubric_feedback,results_grade,results_feedback,results_rubric_feedback,discussion_grade,discussion_feedback,discussion_rubric_feedback,lang_style_grade,lang_style_feedback,lang_style_rubric_feedback,final_grade
100.gpt-5.4-nano_t1.0_original_holistic.run1,100,holistic,original,gpt-5.4-nano,1.0,2026-05-15 23:38:06,5.5,"The introduction contains a generally relevant topic, clear definitions of key constructs (SAD, relapse, inhibitory learning/expectancy violation) and a research aim that culminates in an RQ and hypothesis. However, the line of reasoning is sometimes weakened by imprecise or incorrect phrasing (e.g., conflating “exposure dose” with relapse risk), and by several conceptual/terminological issues (e.g., inhibitory learning explanations remain somewhat general; TG-VRET/SG-VRET mechanisms are asserted more than argued). The prior-research section is present and connected to the study aim, but the synthesis does not consistently build a tight argumentative chain to the exact prediction (e.g., the claim that “therapist involvement enhances VRET outcomes” is stated, then the design excludes some confounds, yet the theoretical justification for why TG should outperform SG is not fully substantiated). References are used, but the reference list includes issues (non-core/possibly irrelevant sources, and at least one citation that appears not to match the intended core literature for the course requirements). Overall: the RQ/hypothesis are present and somewhat justified, but the argumentation to reach them is only partially coherent and not fully well-supported by the required experimental literature line.","Introduction rubric criteria: The paper should clearly and convincingly build a line of reasoning to the RQ, scientific relevance, and hypothesis using existing empirical/theoretical work. The current introduction does include a relevant problem context, definitions, and an RQ/hypothesis, but the argumentative buildup is only partially coherent at times (some claims are asserted without full theoretical linkage; some transitions between prior studies and your specific prediction are not tight). References are generally used responsibly, but the overall set suggests the rubric’s emphasis on correct, representative experimental literature synthesis is not fully met.",6.0,"The methods include most essential elements: sample characteristics and DSM-5 diagnosis procedure, exclusion criteria, randomization to three conditions, a clear intervention description (TG vs SG vs in vivo), matching of dose/task difficulty/sessions, and an operationalized primary outcome (LSAS) with scoring and cutoff. Timing and session structure are specified (8 sessions over 4 weeks; post and baseline assessments). However, important method details are missing/unclear for replication and for proper scientific reasoning: (1) allocation concealment/sequence generation details are vague (randomization sequence mentioned, but not procedure for assignment concealment), (2) the factorial mixed ANOVA in Results implies pre and post only; Methods mention only post-treatment LSAS (fine) but do not explicitly state number of measurement occasions in the analysis terms, (3) there is an apparent mismatch/insufficiency in the Materials/Methods descriptions: the “dependent variable” section mixes some wording and the cutoff is stated as “usually used” without giving a citation in-text; also there is no explicit description of how LSAS assessments were standardized (e.g., blinded assessors—stated as “same person administered all,” but no blinding). (4) In the Methods, there is a sentence fragment (“As these conditions could affect… pose safety risks..”) and unclear wording around medication/exclusions and safety. These issues keep the methods from reaching “complete and correct.”","Methods rubric criteria: Methods should be complete and correct, with a coherent design directly related to the RQ/hypotheses, and participants/materials/procedures described comprehensibly enough to replicate. The study design is coherent (3 arms; randomized; matching dose; LSAS outcome), but several details needed for “complete and correct” are insufficiently specified (allocation concealment/assignment procedure, clarity/blinding of assessment, certain measurement/admin details, and some internal inconsistencies/unclear fragments).",5.5,"The results report the main analysis (2×3 mixed factorial ANOVA) and provides core outputs: main effect of time, main effect of condition, and the time×condition interaction with F, df, and p-values. Descriptive tables/figures are referenced, and the post-hoc approach is mentioned. However, reporting is incomplete and sometimes inconsistent with the ANOVA specified: the ANOVA is described as 3 (group) × 2 (pre vs post), yet df values in the text look inconsistent with a repeated-measures mixed ANOVA for N=90 (e.g., F(1, 87) for time; df for time×condition also reported as F(2, 87), which is unusual given typical repeated-measures df structure). Additionally, no estimated means/standard errors, no effect sizes (e.g., partial eta-squared), and the post-hoc pattern description does not fully match what is implied by the interaction (e.g., stating an “averaged across both time points” difference may require clarification of the simple-effects results). The figure/table content is not actually included in the submission (only placeholders/brief text), which lowers completeness. As a result, Results are only “mostly correct” in structure but not sufficiently complete/accurate in statistical reporting for this rubric.","Results rubric criteria: Reporting and analysis should be correct, complete, and coherent, and relevant to the stated design/procedure. While the correct overall model is named and key F-tests are reported, the statistical reporting appears incomplete/inconsistent (unusual degrees of freedom patterns, limited detail beyond main effects/interaction, limited descriptives/effect sizes, and placeholders rather than concrete tables/figures). This prevents reaching the “complete and correct” level.",6.0,"The discussion contains a stated aim, revisits the hypothesis, summarizes the main findings, and connects them to inhibitory learning and expectancy violation. It also compares at least some findings with prior research (e.g., Kampmann for in vivo vs VR; Anderson/Bouchard conceptual expectations). Critical reflection is present: the lack of follow-up, reduced individual tailoring due to standardization, ecological validity limitations, absence of homework adherence monitoring, and limitations of self-report LSAS are all discussed. Future research directions are specific and relevant (advanced VR cues; additional measurement types; moderators like technology comfort; challenging/falsifying inhibitory learning predictions). However, the reasoning sometimes overreaches: the claim that therapist involvement was “so much less effective” is softened later, but the statistical narrative remains somewhat imprecise (the Results section suggests SG and TG not significantly different at post; the discussion describes them as “statistically similar improvement” but also mentions therapist guidance being “less effective,” which needs tighter consistency). Also, the discussion does not clearly address the non-significant difference between SG and TG with a mechanistic/theoretical argument grounded in the paper’s specific design changes—beyond general ceiling/ecological validity explanations. Still, overall coherence and relevance are adequate-to-good.","Discussion rubric criteria: The reasoning to the main conclusion should be correct/coherent, and critical reflection should be relevant and convincingly argued for, linking back to the theoretical framework and study design. The discussion has an appropriate conclusion, meaningfully connects findings to inhibitory learning, and provides multiple relevant limitations and future directions. However, tighter consistency between results/statistics and specific mechanistic claims would be needed to reach the highest rubric levels.",5.0,"Language is generally understandable but has frequent issues that reduce scientific polish: grammar/typos (“while standard exposure based therapy…,” “VRET trails,” “assessed,” “condion,” “post-assesment”), inconsistent capitalization, and some awkward or ambiguous phrasing (e.g., “delay through a virtual reality environment” style sentences). Paragraph structure is sometimes not single-focus and contains long sentences with multiple claims. APA/statistical style is inconsistent (missing spaces, inconsistent reporting of condition names, and some placeholders in tables/figures). Citations are used, but some are in formats that suggest inconsistent reference correctness. These issues align with a mid-level language/style grade.","Language & Style rubric criteria: Near-faultless scientific language, clear structure (single focus/topical sentences), and minimal APA/grammar/layout errors. The submission is readable but contains frequent grammar/typo issues, inconsistent formatting, and some unclear or multi-claim sentences that reduce the clarity and “graceful style” expected at the higher levels.",5.675
100.gpt-5.4-nano_t1.0_original_holistic.run2,100,holistic,original,gpt-5.4-nano,1.0,2026-05-15 23:38:19,7.0,"The introduction contains a mostly clear line of reasoning from SAD relevance (especially adolescence/long-term impact) to exposure/inhibitory learning, then to the comparison of delivery formats and a (mostly) coherent RQ/hypothesis. However, the theoretical framework is not fully specified in a way that directly maps each delivery factor (therapist presence, ecological validity, exposure dose/practice frequency) onto clear testable expectations; some statements are asserted rather than argued. The transition from prior research to the current study is present and generally logical. Still, reference use is partly irresponsible/inconsistent: the paper cites APA/DSM material in a way that is not clearly aligned with the study’s constructs, and it includes some questionable/irrelevant references (e.g., depression/exercise sources) in the reference list for this SAD/VR exposure paper. Also, the prior-research section does not use the required number of core experimental articles as specified in the course guide (and article details appear mismatched/incorrect—e.g., Kampmann year mismatch), which undermines the scientific reasoning quality even if the narrative is understandable.","Rubric criteria: (1) line of reasoning culminating in a clear, relevant RQ/hypothesis; (2) coherent integration of existing empirical/theoretical work; (3) responsible use of references. Strengths: RQ/hypothesis are mostly clear and the storyline from SAD/exposure/inhibitory learning to delivery-format comparison is present. Development needs: make the mapping from theory constructs to delivery factors more explicit (what exactly should therapist presence change in inhibitory learning and why that yields a smaller/larger symptom change). Ensure the required core experimental articles are correct and relevant, and remove/avoid unrelated or misaligned references; currently the reference list and some article details undermine “responsible use of references.”",6.5,"Methods are mostly coherent and generally aligned with the stated RQ (three conditions; LSAS as DV; random assignment; matched sessions/dose). Participants, inclusion/exclusion criteria, randomization, intervention description, and procedure timing are largely present. However, replication-critical details are missing or unclear: the design states a factorial mixed ANOVA (which is fine), but the method section lacks key details about how safety/therapist fidelity is ensured (TG-VRET), what “adapting scenario intensity” means concretely, and how homework adherence is monitored (it is mentioned as not monitored later). In the Materials section, the description mixes independent variables/time/DV with some procedural-administration language (“integrated into the VR-program”) and does not clearly report the full scoring details exactly as required (e.g., sample item is missing; some thresholds/cutoffs are stated without proper nuance). The inclusion/exclusion section has a punctuation issue and includes an “..pose safety risks..” gap, and there is inconsistency/ambiguity about where baseline diagnosis and randomization occur in the workflow.","Rubric criteria: study design coherent and clearly related to RQ/hypotheses; participants/materials/procedures described comprehensibly; methods complete and mostly correct. Strengths: participant criteria, random assignment, three conditions, intervention matching, and pre/post assessment are largely described. Development needs: add replication-level details (TG-VRET therapist protocol/fidelity, exact randomization method step details, session homework procedure/adherence monitoring plan, and more precise operationalization of therapist vs self-guided differences). Improve questionnaire scoring description to include required items/sample item and adhere to the course checklist style. Fix inconsistencies/clarity issues and eliminate ambiguous or incomplete sentences.",6.0,"Results include the main analysis (2x3 mixed ANOVA) with F and p values, and it reports the key interaction and post-hoc comparisons at pre and post. The overall reporting is mostly understandable and relevant to the stated design. But there are statistical/reporting problems: the ANOVA is described as F(1,87) for time even though a 2-level within factor typically implies df(1, N-1) style; reporting also mixes df values inconsistently with the stated ANOVA structure (later it uses df(2,87) for the interaction). Additionally, Table 1/2 formatting is incomplete (demographics table header without content), and the results do not report means/SDs in Table 2 in the text you provided. The Figure description is present but the results section does not clearly restate effect sizes/CI (not required, but would strengthen). Finally, the sentence about assumption checks is vague for repeated-measures ANOVA (sphericity is not relevant for 2-level time, but it should be mentioned appropriately).","Rubric criteria: data analysis and reporting correct, complete, coherent, and relevant to stated design/procedure; demonstrate in-depth statistical knowledge if aiming higher. Strengths: main effects, interaction, and post-hoc logic are reported, and the results are relevant. Development needs: correct/consistent degrees of freedom and factor labeling for the mixed ANOVA; ensure tables/figures are complete and correspond to reported statistics; provide the necessary descriptive statistics for transparency (means/SDs) in Table 2 as well as demographic table content. Without these, results quality can’t reach the upper rubric bands.",5.5,"The discussion connects the main findings back to inhibitory learning and to prior research, and it does address an unexpected pattern (SG-VRET and TG-VRET not differing). It includes multiple limitations and future directions. However, the scientific reasoning is not yet “convincingly” argued to the rubric standard: some interpretations are speculative or not tightly grounded in the actual reported statistics (e.g., phrases like “therapist guided VRET was so much less effective” conflict with the reported non-significant VRET difference at post and no follow-up). The discussion introduces a “ceiling” explanation without directly testing it or showing supporting evidence from the dataset. Also, it makes an additional claim that VRET was “less effective than in vivo” but does not quantify the magnitude of differences beyond p-values, and it does not discuss the limitation that there is only pre and post (no follow-up), even though relapse/maintenance was a key part of the introduction. Critical reflection includes more than two limitations, which is good, but several limitations are generic or re-stated (e.g., ecological validity, missing follow-up) rather than integrated into a coherent reasoning about how they could produce the observed pattern.","Rubric criteria: reasoning culminating in the main conclusion correct and coherent; critical reflection relevant and convincingly argued; references used responsibly. Strengths: revisits the RQ/hypothesis, compares with prior research, and offers multiple limitations and future research. Development needs: align interpretations tightly with the actual statistical pattern (especially non-significant SG vs TG), quantify/clarify conclusions beyond p-values, and make the theoretical implications more specific (which theoretical elements are supported/refuted by the pattern). Limitations should directly connect to plausible alternative explanations for the interaction pattern and to why the therapist effect did not appear.",6.0,"Overall readability is moderate, with many paragraphs and a clear attempt at scientific tone. However, there are noticeable grammar and clarity issues (missing spaces/punctuation, typos like 'condion', 'post-assesment', 'then' vs 'than', 'Trails' in intro, inconsistent capitalization of conditions). APA/style referencing quality is inconsistent: several citations appear missing year formatting or proper author formatting; the reference list includes items that are not clearly relevant to the stated paper topic (suggesting citation/reference hygiene issues). Statistical/style conventions are sometimes off (e.g., inconsistent factor naming, small formatting glitches in figures/tables). These issues prevent the writing from reaching the “good/excellent” band.","Rubric criteria: near faultless scientific language/structure, minimal APA/layout issues, minimal vague statements/redundancy. Strengths: generally structured paragraphs and scientific framing. Development needs: fix grammar/punctuation/typos and inconsistent formatting of condition names; improve APA referencing consistency and ensure only relevant references are included. Reduce vague wording and ensure statistical terms and condition labels are consistent throughout.",6.225
