run_id,student_id,grading_mode,rubric_version,model,temperature,timestamp,intro_grade,intro_feedback,intro_rubric_feedback,methods_grade,methods_feedback,methods_rubric_feedback,results_grade,results_feedback,results_rubric_feedback,discussion_grade,discussion_feedback,discussion_rubric_feedback,lang_style_grade,lang_style_feedback,lang_style_rubric_feedback,final_grade
169.gpt-5.4-nano_t1.0_improved_holistic.run4,169,holistic,improved,gpt-5.4-nano,1.0,2026-05-15 23:52:04,6.0,"The introduction contains a generally clear topic (SAD), builds a plausible rationale for VRET and for comparing therapist-guided vs self-guided formats, and ends with a clear research aim and hypotheses. However, the line of reasoning culminating in the RQ/hypotheses is only partly convincing: key theories (EPT and the Inhibitory Learning Model) are introduced but are not consistently used to derive more specific, testable expectations about guidance mode (e.g., what guidance changes in expectancy violation/corrective information). Several claims are not clearly grounded in the cited evidence (e.g., expected minimal waitlist change is asserted, but the discussion later hinges on multiple competing waitlist explanations). Also, reference choices/recency are mixed (some sources look like modern review/systematic-review items rather than the required experimental core set for that section’s argumentation). Overall, coherence is adequate but not “good” yet for the course level.","Introduction rubric guidance emphasized: a clear, coherent line of reasoning culminating in the RQ/scientific relevance/hypothesis; and using theory plus empirical work to make the RQ/hypothesis convincing. To score higher, the introduction needs (1) tighter linkage from EPT and inhibitory learning to specific expectations about guidance mode (what mechanism changes with therapist involvement), (2) a clearer “punchline” earlier (why this specific comparison, why guidance mode likely matters), and (3) ensuring the cited evidence is directly relevant and up to date for the specific claims being made (especially distinguishing experimental efficacy evidence from reviews/overviews). Also improve logical connectors where the argument shifts from societal need to theoretical mechanism to research design.",6.5,"Methods are mostly described clearly: eligibility criteria, random assignment to three conditions, sample size and age range, key measures (LSAS-SR), VR hardware/content (with some scenario detail), and the intervention “dosage” (12 sessions, 30 minutes, 6 weeks, two per week) are provided. However, the Methods section is not fully complete/correct for replication and for the specific course expectations: (1) “Materials” includes scoring information but contains inconsistent threshold statements (e.g., “30> indicating SAD” but LSAS-SR cutoffs are typically interpreted differently; additionally the paper reports both “24 items” and “maximum score 144” without explicitly stating how fear/avoidance are scored per item), (2) the procedure omits important timing details (only pre and post are mentioned; yet the Discussion discusses sudden gains, follow-up is not part of results), (3) clinician guidance details are vague (what exactly is standardized vs personalized; how anxiety is monitored with what scale and how progression rules are implemented), (4) planned/statistical analysis details are under-specified (e.g., no effect sizes, no reporting of which correction(s) were used for multiple timepoint comparisons beyond “Holm corrected post-hoc tests,” and ANOVA df values are given without showing the design table/df rationale).","Methods rubric targets a coherent design tied to RQ/hypotheses, and participant/material/procedure completeness so replication is feasible. For higher scores: include all required participant details (including condition sizes in the main Methods text, not only in appendix), clarify intervention components that are standardized vs individualized, specify the clinician monitoring system and progression rules, fix instrument scoring/threshold claims (cutoffs and how max/min scores arise), and ensure procedural timing matches the analysis plan (e.g., if follow-up is mentioned, it must be implemented and analyzed). Also specify analysis plan details (effect sizes, correction strategy, and how the mixed ANOVA is set up).",6.5,"Results reporting is understandable and generally matches the stated design (3-condition × pre/post mixed ANOVA). The key elements are present: outlier check (brief), descriptive table placeholder, assumption checks (Shapiro-Wilk; homogeneity), main effects and interaction, and post-hoc comparisons with p-values. However, there are notable issues for the course standard: (1) inconsistency with the course sample structure: the paper mentions “post-treatment and follow-up” in the Results intro but only reports pre and post in the analyses; no follow-up results exist, and figures/tables are inconsistent with “follow-up” references. (2) There is no actual Table 2 content (means/SD not shown), no effect sizes, and the figure is not provided (it’s referenced but not actually interpretable here). (3) The post-hoc statements use significant p-values but some comparisons are logically unclear (e.g., whether condition differences were tested at both timepoints using the same model/approach). Statistical reasoning is therefore only adequate.","Results rubric expects correct and complete analysis/reporting aligned with the stated design. For a higher band, provide: complete descriptive tables (means/SDs per condition/time), the actual figure/table content, consistent reporting of measurement times (avoid mentioning follow-up if none is analyzed), and more thorough statistical reasoning (effect sizes, and clarity about which comparisons were tested post-hoc). Also ensure p-values and comparison scope match the model and corrections described.",6.5,"The discussion states the aim and a main conclusion that therapist-guided VRET outperformed both self-guided VRET and waitlist at post-treatment, with partial support for hypotheses. It also addresses the “unexpected” finding that self-guided did not outperform waitlist and proposes plausible explanations (adherence/intensity/persistence; feedback absence). It compares with previous research and offers theoretical and practical implications. However, critical reflection is weakened by several problems: (1) the discussion introduces/relies on concepts not firmly set up in the theory section (e.g., developmental “self-sufficiency” and sudden gains/regression are invoked, but the study design does not include follow-up, so some sudden gains discussion is speculative), (2) limitations are lengthy but include some questionable or over-specific future-method suggestions (e.g., stochastic frontier estimation) without clearly justifying suitability for the measurement bias described, and (3) there is no clear, concrete link from EPT/inhibitory learning mechanisms to how guidance mode produced the observed pattern beyond general statements. Still, there are multiple limitations and several future directions, making it adequate rather than developing.","Discussion rubric emphasizes correct main conclusion reasoning and a relevant, convincingly argued critical reflection. For higher scores: explicitly connect results back to the specific theoretical mechanisms from the introduction (EPT/inhibitory learning) and explain how guidance changes those mechanisms; treat unexpected findings carefully without overextending beyond the data (e.g., sudden gains/follow-up claims need the corresponding measurement design); and provide at least two concrete, well-justified limitations plus at least two concrete future directions that directly follow from those limitations/results. Use references responsibly and keep future methods suggestions appropriate to the stated measurement problems.",,,"Language/style rubric rewards scientific clarity, consistent structure (single-focus paragraphs), and low error rates in grammar/APA. For a higher band: reduce terminology inconsistencies and formatting issues (spacing in p-values, decimal/comma consistency, capitalization), avoid vague statements, and ensure reference formatting is consistent with APA 7. Ensure every referenced figure/table is actually interpretable and aligns with what was stated in Results (no mismatches like follow-up vs only pre/post).",
169.gpt-5.4-nano_t1.0_improved_holistic.run5,169,holistic,improved,gpt-5.4-nano,1.0,2026-05-15 23:52:16,6.5,"The introduction provides a generally coherent storyline: SAD relevance and youth focus → exposure/VRET rationale → mechanisms (EPT, inhibitory learning) → guidance vs self-guidance gap → aim, RQ, hypotheses. The RQ/hypotheses are clearly stated and aligned with the gap. However, the theoretical framework is not fully leveraged: EPT/inhibitory learning are introduced, but later the discussion mostly explains effects via guidance/adherence rather than clearly and directly connecting results to specific theoretical predictions (e.g., expectancy violation/corrective information processes). Several references appear less tightly aligned to the exact claims they support (and some feel out of date/newer alternatives are unclear from the text alone), lowering the “convincing” threshold. Overall, this is adequate rather than good.","Rubric criterion: line of reasoning culminating in RQ, scientific relevance and/or hypothesis. Strengths: problem relevance, population linkage, and a clear pathway to the study aim/RQ/hypotheses. Weaknesses to watch: theoretical framework should be more directly and repeatedly used later in the argument (theory → specific expectations → later results/discussion). Also, ensure all referenced claims are tightly aligned (avoid using references that are only loosely connected) and keep the “punchline” (why this specific design/age group/guidance comparison) strongly explicit and early enough. References should be not only relevant but also clearly current for the exact claims made.",6.0,"Methods are mostly present and understandable: participant recruitment/random assignment, inclusion/exclusion criteria, key measures, VR platform/content, therapist- vs self-guided structure, and a basic pre/post assessment schedule. Still, important details are missing or vague relative to what the rubric expects for “complete and correct” methods: (1) group sizes are not stated consistently in the main text (90 total vs 3×30 shown in appendix, but main method lacks per-condition Ns); (2) therapist-guided session details are high-level and do not specify how clinician guidance was standardized (e.g., dosing of coaching, decision rules, therapist fidelity); (3) self-guided adherence/progress tracking is not described (how progress was ensured/monitored); (4) motion sickness safety procedures and debriefing are not mentioned; (5) the analysis plan is not described (no specification of factors/ANOVA structure matching the design, no handling of missing data/dropouts—though none are mentioned). Because of these gaps, it fits the “developing/adequate” range rather than “good/complete”.","Rubric criterion: study design coherence + completeness/correctness of participants, materials, and procedures. Strengths: design is coherent with the RQ; key constructs and main instruments are identified; major inclusion/exclusion criteria are present. To reach “good/excellent”: specify key operational details (group Ns in main text, clinician guidance standardization/fidelity, self-guided progress tracking/adherence procedures, safety/motion sickness management, debriefing), clarify the exact exposure schedule and progression rules, and describe data handling (missing data/dropouts, analysis plan overview).",6.5,"Results reporting is mostly coherent and aligned with the stated design (3 conditions × pre/post mixed ANOVA). You report main effects, the interaction, post-hoc tests, and provide tables/figure placeholders (Table 2, Figure 1). Assumption checks are mentioned (Shapiro-Wilk, homogeneity), which is good. However: (1) there is an inconsistency in the text/analysis description: the Methods and introduction promise therapist vs self-guided vs waitlist with pre/post only, but in the Results section you mention boxplots for “post-treatment and follow-up assessments” and later only use pre vs post (no follow-up analyses are reported). (2) The post-hoc reporting is not fully consistent/complete: you say “between pre and post decreased significantly in all conditions” but you don’t report the test statistic/adjusted p-values consistently beyond listing p thresholds; (3) no effect sizes are reported, which limits statistical reasoning depth (required by rubric as “in depth knowledge of statistical analyses and reasoning”). Hence, adequate-to-developing.","Rubric criterion: correct/complete reporting of data analysis in terms of stated design/procedure and demonstrating in-depth knowledge of statistics. Strengths: the main ANOVA results and interaction are reported; assumption checks are included; post-hoc comparisons are attempted and directionally interpreted. To reach the next band: ensure consistency with the design timeline (no “follow-up” mention if no follow-up analysis exists), report effect sizes (e.g., partial eta-squared, Cohen’s d/standardized contrasts), and present post-hoc results more systematically (including adjusted p-values and test details) with clear linkage to hypotheses.",6.5,"The discussion clearly restates aim and main conclusion, compares findings to prior work, offers explanations for unexpected findings (especially self-guided and waitlist improvements), and includes limitations and future directions. There is some critical reflection (e.g., measurement bias, lack of follow-up, cultural mismatch, etc.). However, theoretical implications are somewhat thin: EPT and inhibitory learning are mentioned earlier, but the discussion later explains mainly via guidance/adherence and speculative developmental arguments rather than linking results back to specific mechanisms (e.g., expectancy violation magnitude, corrective information incorporation) in a structured way. Some future directions are also overly broad or methodologically questionable (e.g., “stochastic frontier estimation” for response-shift bias without clear reasoning in this context). Overall, it reaches adequate rather than good/convincing-in-depth.","Rubric criterion: correct main conclusion reasoning and relevant, convincingly argued critical reflection and limitations/future directions. Strengths: main conclusion is coherent with results; unexpected findings are addressed; limitations include multiple aspects. To reach “good”: connect results back more explicitly to the theoretical mechanisms named in the introduction (EPT/inhibitory learning) and ensure future directions are methodologically justified and clearly motivated by the study’s limitations. Also, keep the explanation of effect sizes and waitlist effects grounded in the reported analysis rather than speculative extensions.",6.0,"Language is generally readable, with a mostly scientific tone. Structuring is present (clear headings, paragraphing), but there are several issues affecting the “good” threshold: occasional awkward phrasing and spelling/typography problems (e.g., spacing around references/commas, “m=-43.33” without context, inconsistent symbols like p=.008 vs p = .008 style, some placeholder-like language in figure references). APA referencing is mostly consistent in the reference list, but there are many irregularities (in-text spacing/typos, and at least one apparent formatting/entry issue such as a key publication year/title mismatch risk in the reference list). These problems keep it in the adequate/developing band rather than good/excellent.","Rubric criterion: near-faultless or faultless scientific language, clear structure, minimal errors in grammar/spelling/APA, and few vague/ambiguous statements. Strengths: headings and overall readability are okay. To reach higher bands: maintain consistent statistical/APA formatting (spacing, p-value formatting, italics, dash/en dash conventions), reduce typos and placeholder-like inconsistencies, ensure all figures/tables are referenced correctly, and keep terminology consistent throughout (e.g., “follow-up” vs only pre/post). Minimize vague statements and improve precision in numerical reporting and interpretation.",6.375
18.gpt-5.4-nano_t1.0_original_holistic.run1,18,holistic,original,gpt-5.4-nano,1.0,2026-05-15 23:52:26,1.0,"No Introduction section was provided, so there is insufficient basis to evaluate the line of reasoning culminating in the RQ, scientific relevance, hypothesis, and responsible use of references.","Introduction rubric emphasizes: (1) a clear line of reasoning leading to the RQ, (2) explicit scientific relevance early, (3) correct, coherent hypothesis linked to empirical/theoretical work, and (4) responsible, relevant referencing. To score higher, the Introduction must include these elements in a logically structured storyline (hourglass model), with key constructs and transitions and minimal late/purely implicit “punchline.”",5.0,"The Methods contain several required elements (recruitment, inclusion/exclusion criteria, demographics in the table at the end, materials with instrument description and scoring/cut-off, and a substantial procedural description of each condition). However, there are major issues that prevent a high score: (1) core design details are internally inconsistent with the presented analysis (e.g., “three treatment conditions: Waitlist, VRET, and VRET exposure-based CBT homework” but participants are also said to be assigned to “one of the three conditions” without clarifying timing/total study length consistently; also randomization details are minimal), (2) procedural details mix “materials” and “procedure” language (e.g., intervention description repeats across sections), (3) compensations and allocation to conditions are not clearly described as part of assignment in a replicable way, (4) the analysis section in Results mentions assumptions (Levene/Shapiro) without matching the difference-score framing in Results, and (5) there are clarity/redundancy problems and some missing essentials expected at this level (e.g., explicit description of measures administration timing beyond pre/post, and clearer differentiation of waiting-list procedures).","Methods rubric emphasizes coherence between design and stated RQ/hypotheses, and completeness/correctness of Participants, Materials, and Procedures. To reach higher levels, the study should be described replicably: clear in-/exclusion criteria with rationale, explicit randomization/allocation procedures, participant compensation details, precise intervention differences (what exactly changes vs stays constant), and clear dependent measure administration/scoring details. Avoid internal inconsistencies (e.g., sample size/df/analysis framing) and ensure procedure vs materials boundaries are respected.",4.0,"The Results report an overall mixed ANOVA framework and include assumption checks, main effects, an interaction, post-hoc comparisons with Holm correction, a descriptives table, and a figure placeholder. But there are substantial reporting/logical problems relative to the described analysis: (1) The first sentence claims analysis on “180 difference scores” but the design described is a 2x3 repeated-measures structure with pre and post; difference-score wording is inconsistent with the subsequent ANOVA description. (2) The stated ANOVA degrees of freedom appear inconsistent with N=180 and a within-subject factor of 2 (the df reported are unlikely as written). (3) The post-hoc testing description is unclear/incoherent (e.g., conditioning on “time” vs “condition” and listing p-values without the exact comparisons; also an apparent contradiction: interaction is significant but then the text first says “no significant difference between VRET and VRET with homework,” which should be consistent with the post-hoc tests but is not cleanly presented). (4) The Results do not present the means/SDs for pre and post in a coherent table (Table 2 is referenced but not actually shown in the provided text beyond one set of values). (5) Outlier handling is mentioned but not handled analytically (no details on how many, criteria, sensitivity analyses).","Results rubric focuses on whether data analysis and reporting are correct, complete, coherent, and relevant to stated design/procedure. Strong papers provide: accurate test statistics/df, consistent framing with the design (e.g., repeated-measures structure vs difference-score wording), understandable tables/figures for main outcomes, clearly specified post-hoc comparisons, and appropriate reporting of assumption checks/outliers including what was done with them.",3.5,"The Discussion attempts to interpret findings and link to prior studies and theory. However, its scientific reasoning is not yet convincing and contains notable gaps: (1) The main unexpected finding(s) are not handled carefully—e.g., the paper treats “no difference between VRET and VRET+homework” as both expected/partly expected in one place and then “unexpected” or inconsistent in another, without clear alignment to hypotheses. (2) Several interpretations rely on theory claims that were not clearly tested or operationalized (e.g., inhibitory learning transfer, context dependence) without showing how the present design allows that inference (no follow-up, no real-world exposure manipulation details tied to learning transfer). (3) Limitations are included, but they are partly generic and partly speculative; some limitations are also inconsistent with the methods actually reported (e.g., claims about inhibitory learning targeting only behavioral symptoms are not grounded in how homework vs no homework specifically changed mechanisms). (4) There is critical reflection, but not at the depth required: at least two concrete, design-specific limitations and corresponding future directions are partially present, yet the reasoning remains somewhat unstructured and sometimes reverts to high-level statements. (5) The final conclusion overstates “accessible alternative / overcoming barriers” without direct evidence in this study (e.g., no adherence, dropout, or acceptability outcomes).","Discussion rubric emphasizes: (1) correct main conclusion tied to the results, (2) coherent and convincing critical comparison with prior studies, (3) explicit linking of findings back to the theoretical framework, and (4) relevant, well-argued critical reflection with concrete limitations and future research implications. High scores avoid overclaiming beyond the study design (e.g., no acceptability/follow-up outcomes but claiming durability/accessibility).",5.0,"Overall readability is moderate, but there are many clarity and scientific-writing issues: tense/wording shifts, several grammatical problems and typos (e.g., “posttreatment/posttreatment,” “conditioned either on condition or time,” “difference scores” framing), inconsistent terminology (FNE-B vs FNE), and unclear sentence structure in Results and Discussion. APA referencing is mostly present, but there are issues in formatting (e.g., some references look inconsistently formatted; some figure/table captions are incomplete). Scientific style is generally maintained, but argumentative signposting and sentence-level precision need improvement.","Language & Style rubric rewards near faultless scientific language, clear component/paragraph structure, topical sentences, minimal vague/ambiguous statements, and correct APA referencing/layout. To improve: use precise statistical and methodological wording (consistent constructs and measurement labels), correct grammar/typos, ensure clear signposting, and maintain consistent terminology and formatting across tables/figures.",3.2
